ticker,companyName,url
A,AGILENT TECHNOLOGIES INC,https://www.nyse.com/quote/XNYS:A
AA,ALCOA CORPORATION,https://www.nyse.com/quote/XNYS:AA
AAC,ARES ACQUISITION CORP,https://www.nyse.com/quote/XNYS:AAC
AAC.U,ARES ACQUISITION CORP UNIT 1 COM & 1/5 WT EXP,https://www.nyse.com/quote/XNYS:AAC.U
AACG,ATA CREATIVITY GLOBAL SPON ADS EACH REP 2 ORD SHS,https://www.nyse.com/quote/XNMS:AACG
AACOU,ADVANCIT ACQUISITION CORP I UNIT 1 CL A & 1/3 WT EXP(25/02/2026),https://www.nyse.com/quote/XNCM:AACOU
AACQ,ARTIUS ACQUISITION INC,https://www.nyse.com/quote/XNCM:AACQ
AACQU,ARTIUS ACQUISITION INC UNIT 1 COM & 1/3 WT EXP(13/07/2025),https://www.nyse.com/quote/XNCM:AACQU
AAIC,ARLINGTON ASSET INVESTMENT CORP,https://www.nyse.com/quote/XNYS:AAIC
AAICpB,ARLINGTON ASSET INVESTMENT CORP 7% CUM PRF 12/05/2022 SER B USD25,https://www.nyse.com/quote/XNYS:AAICpB